{
  "contract_version": "generation-plan/1",
  "plan_id": "gp_4f5a6b7c",
  "scope_id": "gs_1a2b3c4d",
  "pack": "fixture-minimal",
  "pack_version": "0.1.0",
  "entries": [
    {
      "ko": "ko.definition.sales.customer",
      "class": "type",
      "track": "deterministic",
      "path": "src/sales/types/customer.ts",
      "state": "new"
    },
    {
      "ko": "ko.definition.sales.proposal",
      "class": "type",
      "track": "deterministic",
      "path": "src/sales/types/proposal.ts",
      "state": "new"
    },
    {
      "ko": "ko.definition.sales.proposal-already-issued",
      "class": "type",
      "track": "deterministic",
      "path": "src/sales/types/proposal-already-issued.ts",
      "state": "new"
    },
    {
      "ko": "ko.definition.sales.proposal-expired",
      "class": "type",
      "track": "deterministic",
      "path": "src/sales/types/proposal-expired.ts",
      "state": "new"
    },
    {
      "ko": "ko.definition.sales.proposal-item",
      "class": "type",
      "track": "deterministic",
      "path": "src/sales/types/proposal-item.ts",
      "state": "new"
    },
    {
      "ko": "ko.definition.sales.proposal-not-issued",
      "class": "type",
      "track": "deterministic",
      "path": "src/sales/types/proposal-not-issued.ts",
      "state": "new"
    },
    {
      "ko": "ko.definition.sales.proposal-terminal",
      "class": "type",
      "track": "deterministic",
      "path": "src/sales/types/proposal-terminal.ts",
      "state": "new"
    },
    {
      "ko": "ko.lifecycle.sales.proposal",
      "class": "conformance-test",
      "track": "deterministic",
      "path": "src/sales/conformance/proposal.test.ts",
      "state": "new"
    },
    {
      "ko": "ko.lifecycle.sales.proposal",
      "class": "state-machine",
      "track": "deterministic",
      "path": "src/sales/state/proposal.ts",
      "state": "new"
    },
    {
      "ko": "ko.rule.sales.proposal-expiration",
      "class": "conformance-test",
      "track": "deterministic",
      "path": "src/sales/conformance/proposal-expiration.test.ts",
      "state": "new"
    },
    {
      "ko": "ko.rule.sales.proposal-expiration",
      "class": "validator",
      "track": "judged",
      "path": "src/sales/validators/proposal-expiration.ts",
      "state": "new"
    }
  ]
}
